{"consecutive_failures":0,"last_attempt_at":"2026-10-19T13:28:19.230814Z","last_error_code":"item_ingestion_failure","last_run_id":"run-v1-35a4dcc1-b5c4-48c6-9a86-13f67c7cc268","last_success_at":"2026-10-19T13:28:38.593237Z","source_id":"bdns","status":"healthy","updated_at":"2026-10-19T13:28:38.593237Z"}
